{
  "version": "0.2",
  "project": {"name": "exemplo-tipografia", "format": "youtube_long", "profile": "generic"},
  "audio": {"narration": "audio/narracao.wav"},
  "timeline": [
    {
      "id": "titulo-anton", "start": 0, "end": 4, "layout": "3x3",
      "background": {"color": "#172033"},
      "elements": [
        {"id": "pergunta", "type": "text", "text": "O QUE ACONTECEU?", "style": "anton", "cells": [2, 5, 8], "start": 0, "end": 4,
         "reveal": {"charactersPerSecond": 9},
         "textStyle": {"fontFamily": "Anton", "uppercase": true, "color": "#FFFFFF", "outlineWidth": 0}}
      ]
    },
    {
      "id": "titulo-bangers", "start": 4, "end": 8, "layout": "3x3",
      "background": {"color": "#EFE4C8"},
      "elements": [
        {"id": "resposta", "type": "text", "text": "UMA VIRADA!", "style": "bangers", "cells": [2, 5, 8], "start": 4, "end": 8,
         "textStyle": {"fontFamily": "Bangers", "uppercase": true, "color": "#FFFFFF", "outlineColor": "#172033", "outlineWidth": 6,
                       "shadow": {"color": "#000000", "blur": 8, "offsetX": 3, "offsetY": 4}}}
      ]
    }
  ]
}
